{
  "schema_version": 1,
  "stage": "run",
  "status": "complete",
  "generated_at": "2026-08-06T10:00:00+09:00",
  "data": {
    "project_name": "team3-end2end/end2end",
    "report_title": "NYC Yellow Taxi 결제수단 예측 보고서",
    "run_id": "sample-2026-08-06",
    "source_revision": "SAMPLE",
    "dataset": {
      "name": "NYC Yellow Taxi 2026-05",
      "path": "eda/yellow_tripdata_2026-05_snappy.parquet",
      "period_start": "2026-05-01",
      "period_end": "2026-05-31",
      "shape": {"rows": 4090836, "columns": 20}
    },
    "target": {
      "name": "payment_label",
      "problem_type": "multiclass_classification",
      "classes": ["신용카드", "Flex Fare", "현금"]
    },
    "is_sample": true
  },
  "error": null
}
